id,title,description,price,count
b8466e83-eaa2-4421-856e-c0aaf78f73af,Classic tour of Minsk,Explore all the most important sights,11,5
0876d6c4-db6c-4dfd-bb64-6b4ccfe27579,Modern Minsk tour,See how Minsk has left Soviet legacy behind and stepped into the future,34,19
2254b35f-8570-4fcf-aa08-f1f4708e04b3,Alternative Minsk tour,For those who want something off the beaten track,16,8
eeaf9772-f6b2-4896-b569-3f5a2b30dc4d,Minsk and Soviet heritage,Let us face it: Minsk still resembles a classic Soviet-era city. Explore the past today!,11,15
3c554321-b3f8-49bf-85db-ea11aa1ddbea,Famous people of Minsk,Did you know that lots of world-famous people were born or lived in Minsk? You will be surprised!,28,20
